<?xml version="1.0" encoding="UTF-8" standalone="no" ?>
<listin xmlns:xsi="http://www.w3.org/2001/XMLSchema-instance"
           xsi:noNamespaceSchemaLocation="listin.xsd">
    <contacto id="Mggodos" sexo="hombre">
        <nombre>Marcos</nombre>
        <email>mggodos@gmail.com</email>
        <relacion amigo_de="eider"></relacion>
    </contacto>
    <contacto id="eider" sexo="mujer">
        <nombre>Eider</nombre>
        <email>eider@gmail.com</email>
        <relacion amigo_de="Mggodos"></relacion>
    </contacto>
</listin>